{
  "archetypeId": "LEG-DPA-2026-v1",
  "name": "Data Processing Addendum (DPA) - GDPR Compliant",
  "version": "1.0.0",
  "contentHash": "e3b0c44298fc1c149afbf4c8996fb92427ae41e4649b934ca495991b7852b855",
  "effectiveDate": "2026-06-17T12:00:00Z",
  "signatories": [
    {
      "identity": "Multiplicity_Foundation_Owner",
      "role": "Owner",
      "publicKey": "ZEd2NTUxOV9Pd25lcl9QdWJsaWNfS2V5X1ZhbHVlPT0=",
      "signature": "ZEd2NTUxOV9Pd25lcl9TaWduYXR1cmVfVmFsdWVfV2l0aF9FZEQ1NTE5X0tleV9QcmVzZW50X0hlcmU="
    },
    {
      "identity": "Phase_Mirror_Governor",
      "role": "Governor",
      "publicKey": "ZEd2NTUxOV9Hb3Zlcm5vcl9QdWJsaWNfS2V5X1ZhbHVlPQ==",
      "signature": "ZEd2NTUxOV9Hb3Zlcm5vcl9TaWduYXR1cmVfVmFsdWVfV2l0aF9FZEQ1NTE5X0tleV9QcmVzZW50X0hlcmU="
    }
  ],
  "auditMetadata": {
    "complianceFramework": "GDPR",
    "auditStatus": "Approved",
    "reviewer": "Audit_Officer_01",
    "notes": "Verified GDPR adequacy standard clauses for cross-border transit."
  }
}
